Mno,First name,MI,Last name,DoB,Address,Status,msd,med,rdate,Phone,Email,Notes
1,Sara,Lorraine,Murray,January 05 1969,"366 Kylie Trail Apt. 766, Mitchellborough, HI 22386",None,May 07 2016,January 24 2020,November 13 2022,8528963724,kristinalove@example.net,"Parent successful arrive condition tree create. Wind or that. Body we spring buy.
Build executive firm. Represent occur blood improve. Direction they customer garden prepare voice."
6,Robert,Timothy,Lowe,May 21 1959,"0968 Byrd Drives, Whitemouth, HI 11893",None,November 18 1988,December 22 2006,November 26 2022,1809106258,patriciawatkins@example.org,"Study law research color it less with.
Dinner human court system. Suggest expert fine two other sound none. Church common guess environmental."
3,Felicia,Ricardo,Jones,January 21 2001,"USS Dixon, FPO AE 91691",Basic,December 13 2020,,September 03 2022,6415280581,michellejones@example.com,Point present reflect middle capital wonder their military. Family power together know according.
22,Erica,Lisa,Anderson,October 19 1997,"02580 Nelson Trail, Robersonfurt, VT 94423",Basic,April 26 2022,,June 09 2024,5398365438,randy04@example.net,"Scientist former hard rise ok age see development. Community onto teacher reflect.
Program product always realize better glass. Success stock body wall one east. Help floor result think."
17,Troy,Lisa,Meadows,July 28 1973,"586 Garcia Isle, South Charles, MO 93586",None,July 07 2013,January 01 2018,May 14 2026,9655752551,antonio96@example.org,Difference heart arrive remember where south. Speech like expect. Commercial mother live teach. Chance pressure really close similar herself.
21,Jon,Alan,Martin,May 04 1981,"Unit 9671 Box 2972, DPO AA 66849",None,February 28 2010,May 20 2018,September 21 2026,6556379544,rbeltran@example.org,Discussion way movie vote wonder yet. Want affect write light contain player.
16,Ashley,Steven,Sanders,January 19 1968,"1730 Ramirez Brook, Daltonville, KS 43391",None,October 21 1988,December 16 1993,October 04 2025,8137753254,gravesnicole@example.org,"Share act those. Wall majority second change store source brother.
Commercial sign remain true. During take shoulder.
Board son yeah."
9,Sandra,Nicole,Stone,November 22 1952,"3530 Pitts Lodge Suite 189, South Adam, MA 05114",None,August 09 1984,April 20 2000,January 26 2025,6231774101,martinezpatricia@example.net,"Only prove billion analysis contain. Forget station a worry various tend activity.
Save themselves about throughout field. Blood hand red party."
19,Thomas,Kristina,Gillespie,September 09 1992,"2264 Catherine Harbor, New Mathew, KY 34939",None,July 16 2017,August 23 2021,October 09 2023,8558589904,plee@example.org,Physical run decision hotel certainly meet southern. Explain know same sure away throw. Box life close stand exist avoid. Industry science final.
18,Margaret,Casey,Watson,July 11 1945,"Unit 9619 Box 2754, DPO AA 68755",None,March 30 1981,September 13 1984,May 24 2023,2653855801,justin08@example.net,History entire business. Size personal letter measure federal.
32,Kenneth,Curtis,Rodriguez,October 06 1990,"9172 Thomas Fall, East Kelly, LA 88674",None,March 29 2011,October 08 2019,June 11 2023,6930973913,kristen48@example.org,"Family tree ask nice open. Go this billion perhaps player year nor. Choose born top why see in.
History follow represent sign. Leave student rather perhaps usually seven."
11,Logan,Edward,Moore,December 20 1966,"720 Kelly Inlet Apt. 014, Port Miguelfurt, SC 39629",None,January 15 1996,August 30 1998,July 02 2022,9064592512,katherine70@example.com,"Lead forward idea main. When benefit country difficult area turn we attack.
Wonder compare bar with education. Person hard voice amount practice act big. Effort perhaps property foreign friend issue."
38,Dawn,Stephanie,Smith,September 19 1988,"PSC 7659, Box 6187, APO AA 22727",Silver,January 03 2009,,December 02 2026,9084237939,bonnie24@example.com,"Building tax as plan even. How friend business nor fly degree forget.
Bed forget meet itself director. Improve organization significant trade. Institution those site interview."
10,Jeffrey,Ryan,Martin,May 14 1992,"406 Padilla Lodge Suite 705, Shafferfurt, OH 76265",None,November 26 2019,August 04 2021,August 23 2026,5059273683,nathaniel75@example.com,"Family brother interesting.
General many site security science center third. Approach language about yet expert.
Leg west song look expert idea grow. Pattern his over important actually magazine."
25,Robert,Jo,Martin,April 09 1947,"6530 Mitchell Freeway Apt. 233, Lake Dawn, VA 24848",None,April 04 1986,August 01 1992,May 28 2025,3617597801,xbaker@example.net,Land soon specific good. My scene expert consider conference result line area. Available record list security performance former edge source.
4,Johnathan,Matthew,Munoz,October 25 1975,"8193 Jimenez Brook Apt. 901, Meganview, WV 66244",None,June 14 2013,April 04 2014,May 29 2025,7969922925,sarah16@example.com,Door social throughout in majority. Strategy compare any financial least benefit describe. Edge tell set hear attention suddenly. Current important character girl hot about fill.
26,Todd,Jeffrey,Potts,November 09 1959,"3285 Smith Squares, Lake Michellehaven, AL 53296",None,September 01 1996,August 11 1997,January 08 2025,8671409107,austinking@example.org,"Simply assume land side base learn. How back report compare method player. Whom we whose fund something.
Catch hour boy tough industry student. Outside Mrs arm strategy. Skin clearly test plant."
23,Matthew,Sheila,Morris,July 03 1988,"4417 Paul Curve Apt. 590, Lake Jason, DC 40842",Gold,April 29 2016,,February 14 2024,3322497028,elee@example.net,"Popular Congress their Mr mind. Director thing right quickly have something try. Interest wonder Mr manage.
Condition ahead course power member. International seem walk serious go garden movement."
0,Ryan,Mary,Mitchell,October 04 1950,"5392 James Valley Apt. 334, Michaelview, TN 73284",None,January 07 1972,July 12 1978,October 25 2024,2071285185,floreschristopher@example.com,Area middle suddenly describe within fly. Animal dream I discussion where enough. Usually on manager indeed position leave because.
31,David,Jimmy,Patel,March 10 1968,"353 Nicholas Run Suite 669, New Brandon, FL 44122",None,May 25 2003,August 01 2019,July 02 2026,7910619643,daniel60@example.org,"Bad evening specific trial color away marriage. Really whole interest not attorney receive likely.
Few financial mind relate. Heart same material me although body. Spend step Democrat me own few."
5,Caleb,Brian,Saunders,July 10 1955,"76356 Price Orchard Suite 768, Lake Rachel, AR 64101",None,October 01 1985,July 11 2007,September 12 2022,3349446226,jwu@example.org,"Economic paper official leg phone yeah. Fish partner least direction TV. Full unit author father stop fish.
Image analysis tree husband. According add college field foreign north."
27,Robert,Joshua,Peterson,October 27 1953,"0771 Joy Overpass, Morganmouth, DE 54268",None,July 29 2015,November 27 2018,April 05 2024,7484462333,alexis18@example.org,Establish notice live red data alone quite. History seven yes machine town cell. Protect professor science language defense.
20,John,Jean,Hawkins,October 05 1979,"53885 Catherine Heights, Harperville, SC 61338",Platinum,January 15 2012,,September 21 2024,8832938330,davilamark@example.org,Wall respond cultural. Hit tax event factor east south. Building develop often call really growth it. At enough safe trade back employee book.
35,Bradley,Alexandria,Gonzales,August 18 1945,"218 Savannah Port Apt. 581, Deborahland, OR 09710",None,May 03 2016,June 25 2017,April 04 2024,1890056820,smithaaron@example.net,"Than chair whatever far development partner subject. Soon decision imagine anything us support factor record.
Family fish necessary onto nor leader give fear. Argue walk knowledge."
15,Savannah,Natalie,Michael,September 19 1970,"3307 Zachary Square Suite 418, Jonathanmouth, UT 06680",None,October 10 2006,March 20 2010,December 26 2023,1947222342,carriebutler@example.com,Part thus nearly be career campaign local. Sense physical raise growth institution movement its.
30,James,Monica,Cowan,October 01 1962,"945 Roberts Plains, Knightchester, WA 22165",None,September 12 1981,June 10 1993,November 08 2023,5173823654,njohnson@example.net,Eat order direction road organization. Record baby anyone arrive. Network system those drive. Truth girl affect entire him young must shoulder.
33,Kaitlyn,Elizabeth,Shea,July 15 1988,"PSC 4784, Box 7027, APO AE 77565",Basic,October 19 2019,,January 10 2026,6982086887,armstrongeileen@example.com,"Fast measure sea serious. Blood accept collection along. Economic side section sit raise million Republican surface.
Hard visit act oil at our. Set wait trial budget onto close bank finish."
28,Joel,Todd,Gibson,June 27 1973,"67466 Bruce Lodge Apt. 090, Kristenbury, CO 17633",Gold,April 13 2021,,July 20 2026,2428553761,wgonzalez@example.org,Leg product worker smile. Up think apply society hear language old. Task play long population.
39,Jason,Molly,Irwin,December 07 1995,"3507 Lauren Trail, Port Katherineside, OR 54392",Basic,December 13 2020,,December 13 2024,7328613782,debbie80@example.net,"Fly worry his community commercial. Pay could eye practice.
Floor black each defense. Boy south knowledge popular result themselves would. Wind find month task."
29,Robert,Jennifer,Downs,November 24 1992,"9543 Timothy Mountain Apt. 794, West Kim, NH 13686",None,September 12 2020,May 21 2022,June 21 2027,2580363021,john83@example.net,"Center guess bank admit.
Its word while. Win list natural maybe actually Democrat. Decide he chair.
Everyone full government population. Right blue president get.
Traditional community doctor."
14,Michelle,John,Garcia,March 11 1987,"USNS Baker, FPO AA 68762",None,March 25 2017,October 09 2020,February 25 2026,4313292910,wardkyle@example.com,"Guy market property form model call. Both seem story save cost so moment.
American on skin day threat century method. Begin activity long sort society free else sea."
24,Robin,Stephen,Price,January 17 1987,"9203 Jacobs Bypass, Lake Eric, HI 33482",Silver,September 30 2005,,July 09 2023,6511285260,leekevin@example.com,"Rich east attention front century. When style attack wind. Police they spring thank.
Think issue never situation my. Place whole history account lawyer rate girl. Building language collection forget."
7,Joseph,John,Bass,June 09 1948,"4037 Jermaine Meadows, Rachelmouth, HI 70352",None,November 25 1980,April 17 1992,July 29 2023,1653211259,zanderson@example.net,Great respond almost be. Business person for note. By throw today catch avoid network here necessary.
34,Samuel,Dustin,Miller,March 20 1946,"6426 Angela Glens, Henryburgh, CA 68434",None,October 04 1970,July 27 1990,March 19 2026,309362761,ybaker@example.org,Only benefit because either these decision high. Energy industry worker win skill. Three couple across ground tax school decision.
36,Brittney,Scott,Lewis,December 30 1969,"89850 Emily Path, Caseyland, AZ 20495",None,April 22 2009,November 15 2018,May 13 2026,8546798414,bgilbert@example.net,"Easy indeed member statement. Wear plant letter grow material arm. Home go always actually fear offer.
Born certainly nation ask member our life. Meet maintain defense."
12,Timothy,James,Ball,January 28 1964,"921 Lopez Place Suite 951, South Rachel, VT 83678",None,June 15 1982,October 20 2017,March 07 2023,4532680308,petersjason@example.com,"Girl people hold fire simple easy decision. Front decision listen actually reason kitchen.
Majority involve throughout value. Yard forward trade evening price poor event."
2,Amanda,Scott,Ruiz,November 09 1970,"58198 Martha Canyon, East Joseph, ID 97309",None,January 09 2010,December 27 2020,September 09 2026,5613427582,adam38@example.net,Development no bit other pull decision theory final. Nothing impact individual. Arm television draw these.
37,Russell,Michael,Swanson,May 17 1964,"PSC 5812, Box 5197, APO AE 92798",None,March 09 1991,October 24 2007,August 27 2026,4165742538,kaitlincook@example.com,"Heavy radio put team. Girl model consumer paper manage. Energy this many daughter debate radio speak.
Officer Republican much bag dream action above."
13,Samuel,Melissa,Wall,March 05 1962,"9107 Tyler Plain Apt. 902, Jamieport, VT 39094",None,May 02 1989,February 16 2018,June 06 2026,7038099259,dennis38@example.com,"Audience economic sense far last tell series. Be challenge design cold this head decision.
Price major help generation. Certainly because measure spring particular material. Later alone hold have."
8,Donna,Christopher,Bailey,July 29 1952,"174 Kelly Plains Apt. 360, Jeffreyfurt, NH 52037",Platinum,February 13 2021,,July 15 2024,9083436900,heather14@example.net,"Skill music sound measure important nice almost. Week entire herself listen half build line. Current model difficult particular.
But reflect his serve into bad dinner. Could actually Congress."
